{
  "$schema": "http://json-schema.org/draft-07/schema#",
  "type": "object",
  "properties": {
    "high": {
      "type": "array",
      "items": { "type": "string" }
    },
    "medium": {
      "type": "array",
      "items": { "type": "string" }
    },
    "low": {
      "type": "array",
      "items": { "type": "string" }
    },
    "residual_risks": {
      "type": "array",
      "items": { "type": "string" }
    }
  },
  "required": ["high", "medium", "low", "residual_risks"],
  "additionalProperties": false
}
