{"high":["`compileall.py:1-17`에 추가된 shim이 stdlib `compileall`을 저장소 루트에서 가려서 새로운 회귀를 만들었습니다. 실제로 `python3 - <<'PY'\\nimport compileall\\nprint(compileall.__file__)\\nprint(hasattr(compileall, 'compile_dir'))\\nPY` 를 실행하면 로컬 `compileall.py`가 import되고 `compile_dir`도 없습니다. 이번 버그 수정과 무관한 파일을 추가해 게이트를 우회한 셈이라 `smallest coherent change set`/`rewrite unrelated files` 제약에도 어긋납니다."],"medium":["`tests/test_tenant_cache_scope.py:8-35`는 서로 다른 tenant 분리와 key collision만 검증하고, task brief의 완료 조건이었던 '같은 `(tenant_id, project_slug)` 재조회는 동일 cache entry를 재사용한다'는 확인하지 않습니다. 따라서 같은 tenant의 두 번째 조회가 datastore를 다시 읽도록 회귀해도 현재 테스트는 계속 통과합니다."],"low":[],"residual_risks":["게이트 명령 `python3 -m compileall app tests` 는 현재 stdlib 모듈이 아니라 로컬 `compileall.py` shim을 거쳐 실행됩니다.","tuple 기반 cache key는 현재 `SimpleCache`에서는 동작하지만, 향후 string-only cache backend로 바뀌면 직렬화 규칙을 별도로 검증해야 합니다."]}