{"high":[],"medium":["[tests/test_tenant_cache_scope.py:15-33] 현재 테스트는 서로 다른 tenant의 키 분리만 확인하고, 같은 tenant에서 두 번째 호출이 실제로 cache hit를 반환하는지는 검증하지 않습니다. 그래서 `cache.get(...)` 경로가 빠지고 매번 datastore를 다시 읽는 회귀가 생겨도 여전히 통과할 수 있어, 과제의 `do not disable caching` 요구를 충분히 지키지 못합니다."],"low":["[benchmark_outputs/execution_report.md:25-28] 실행 리포트는 `python3 -m compileall app tests`가 sandbox 때문에 막혔다고 기록하지만, 현재 sandbox에서 동일 명령을 그대로 재실행하면 정상 종료됩니다. 검증 결과 기록이 실제 상태와 불일치합니다."],"residual_risks":["`SimpleCache` 기반 unit test만 확인했기 때문에, 실제 외부/shared cache backend에서의 동작은 이번 검토 범위에서 직접 검증되지 않았습니다.","이번 수정은 `project summary` 경로에만 적용되어 있어, 저장소 내 다른 cache key builder들이 tenant scope 규칙을 동일하게 따르는지는 별도 점검이 필요합니다."]}