{"high":["[app/cache_keys.py:2] 캐시 키를 `project-summary:{tenant_id}:{project_slug}`로 단순 연결해서 `tenant_id='a:b', project_slug='c'` 와 `tenant_id='a', project_slug='b:c'`가 같은 키 `project-summary:a:b:c`로 충돌합니다. 실제로 `fetch_project_summary()`를 이 두 입력으로 순서대로 호출하면 두 번째 요청이 첫 번째 테넌트의 요약과 `tenant_id`를 그대로 반환해 tenant isolation 요구사항이 다시 깨집니다. 현재 테스트([tests/test_tenant_cache_scope.py:19-49](/Users/shinukyi/Gallary/projects/proto/agent-lab/artifacts/benchmark_runs/initial-complex-case-batch/c0-gpt54mini-high__tenant-cache-scope/workspace/tests/test_tenant_cache_scope.py:19))는 이 구분자 충돌 케이스를 검증하지 않아 회귀를 놓칩니다."],"medium":[],"low":[],"residual_risks":["이 저장소 안에서는 `tenant_id`/`project_slug`에 `:` 문자를 금지하거나 이스케이프한다는 계약을 찾지 못했습니다. 외부 입력 제약이 없다면 위 충돌은 운영에서도 그대로 재현 가능합니다."]}