{"high":[],"medium":["`tests/test_flag_rollout_fallback.py:25`는 성공-활성(`True`) 경로와 fetch 실패 경로만 검증합니다. 정상 fetch에서 플래그가 비활성(`False` 또는 키 미존재)일 때도 `flag_exposure`가 정확히 1회만 기록되는지에 대한 회귀 테스트가 없어, 가장 흔한 disabled-by-config 경로의 중복 노출 회귀를 놓칠 수 있습니다."],"low":["`benchmark_outputs/execution_report.md:25`는 `python3 -m compileall app tests`가 sandbox 때문에 `CONDITIONAL PASS`라고 기록하지만, 현재 sandbox에서 같은 원본 명령을 재실행하면 추가 환경변수 없이 그대로 통과합니다. 실행 보고서의 검증 결과가 실제 상태와 어긋나 있어 이 런의 수용 판단을 오도할 수 있습니다."],"residual_risks":["`record_exposure` 자체에는 중복 방지 로직이 없어, 앞으로 다른 호출 경로가 같은 평가에서 helper를 두 번 호출하면 sink 레벨에서는 다시 중복 이벤트가 쌓일 수 있습니다.","이번 변경과 테스트는 `ConfigError` 기반 fetch 실패만 다룹니다. 실제 provider가 다른 예외 유형으로 실패할 때도 fail-closed 계약이 유지되는지는 별도 확인이 필요합니다."]}