{"high":[],"medium":[],"low":[],"residual_risks":["저장된 `benchmark_outputs/execution_report.md`에는 `python3 -m compileall app tests`가 Apple Python cache 권한 문제로 실패했다고 적혀 있지만, 현재 샌드박스에서 동일 명령을 재실행한 결과는 통과했습니다. 산출물 간 검증 기록 불일치는 후속 자동 판정에서 혼선을 줄 수 있습니다.","누락된 flag 값은 현재도 `remote_values.get(...) -> None` 뒤 `bool(value)`로 `False` 처리됩니다. 이는 이번 과제의 비목표와 일치하지만, 해당 의미가 정책적으로 의도된 것인지 문서나 테스트로 명시되지는 않았습니다."]}