{"high":["[app/presence_hub.py:5-10, app/session_store.py:17-26] 권위 세션을 `connected` 이벤트에서만 갱신해서, 더 높은 `(epoch, session_id)`의 `disconnected`가 먼저 도착한 경우를 전혀 기록하지 못합니다. 재현: `old@1 connected` -> `new@2 disconnected` -> `old@1 connected` 순서로 호출하면 저장소의 current 세션이 계속 `old@1`로 남아 마지막 stale `connected`가 그대로 적용됩니다. 이 경로에서는 더 새로운 세션이 이미 관측됐는데도 오래된 세션이 다시 online 상태로 남으므로, \"stale events do not reintroduce the wrong session\"라는 핵심 요구사항과 `docs/realtime_presence.md`의 ordering rule을 만족하지 못합니다."],"medium":[],"low":["[benchmark_outputs/execution_report.md:44-84] 실행 리포트는 `compile_pass`가 exit code 1로 실패했다고 적고 있지만, 현재 `gate_results.json`과 제가 다시 실행한 `python3 -m compileall app tests`는 모두 성공입니다. 검증 아티팩트끼리 서로 다른 결과를 보고하고 있어, 이번 런의 최종 게이트 판단 근거로 쓰기에는 신뢰성이 떨어집니다."],"residual_risks":["`tests/test_presence_race.py`에는 `newer disconnected`가 `older connected`보다 먼저 도착하는 순서가 아직 자동화되어 있지 않아, 위 stale reintroduction 회귀가 계속 숨어 있을 수 있습니다.","현재 게이트 명령 재실행 결과는 모두 통과했지만, 실행 리포트와 게이트 결과 파일의 불일치는 릴리스/리뷰 자동화가 어떤 소스를 진실로 삼는지 추가 확인이 필요합니다."]}