{"high":["[app/presence_hub.py:4-10], [app/session_store.py:17-26], [app/client_presence.py:9-17] 권위 세션의 소유권이 여전히 `connected` 이벤트에만 묶여 있어 boundary가 깨져 있습니다. 문서와 의도는 `SessionStore`가 사용자별 최신 `(epoch, session_id)`를 authoritative source로 보유하는 구조인데, 실제 구현은 더 높은 ordering의 `disconnected`를 저장하지 못합니다. 그래서 `old@1 connected -> new@2 disconnected -> old@1 connected` 순서에서 저장소와 `online_state`가 다시 `old`로 돌아가며, stale 세션 재도입 방지가 hub/client/store 전체의 공통 경계가 아니라 이벤트 타입별 우회 로직으로 분산됩니다. 이 상태는 reconnect 규칙을 다시 바꾸거나 producer를 추가할 때 변경 책임이 세 모듈에 동시에 퍼지는 구조적 결합을 남깁니다."],"medium":[],"low":[],"residual_risks":["`tests/test_presence_race.py`에는 `newer disconnected`가 먼저 관측된 뒤 `older connected`가 뒤늦게 오는 순서가 없어, authoritative ordering 경계가 다시 흐려져도 회귀가 바로 드러나지 않습니다.","`docs/realtime_presence.md:8-10`은 hub가 최신 authoritative session을 저장한다고 계약을 선언하지만 구현은 모든 이벤트 타입에 대해 그 계약을 지키지 못합니다. 이 불일치는 이후 다른 producer나 consumer가 문서를 기준으로 sequencing을 해석할 때 운영 경계를 흐릴 수 있습니다." ]}