{"high":[],"medium":["`app/telemetry.py:9-18`의 dedupe 키가 `(flag_name, user_id, variant)`라서 같은 평가 컨텍스트(`seen_exposures`) 안에서도 variant만 바뀌면 exposure가 중복 기록됩니다. 실제로 `record_exposure('new-dashboard', 'user-1', 'enabled', telemetry, seen)` 뒤에 같은 `seen`으로 `variant='disabled'`를 다시 호출하면 이벤트가 2건 남습니다. 이번 작업의 목표가 \"same flag/user evaluation당 `flag_exposure` 1건\" 보장인 만큼, 현재 telemetry 계층의 dedupe는 그 불변식을 완전히 강제하지 못합니다."],"low":[],"residual_risks":[]}