{"high":["app/session_store.py:1-35, app/presence_hub.py:4-17, app/client_presence.py:4-15: 최신 세션이 `disconnected` 되면 저장소가 마지막으로 본 `epoch`를 완전히 잊어버려, 그 뒤에 도착한 더 낮은 `epoch`의 stale `connected` 이벤트를 다시 받아들입니다. 재현: `connected(old,1) -> connected(new,2) -> disconnected(new,2) -> connected(old,1)` 순서로 호출하면 최종 상태가 다시 `old`로 복원됩니다. 문서의 \"lower epoch must be ignored\" 규칙과 작업 요구사항(늦게 도착한 stale 이벤트가 더 최신 세션을 다시 덮지 못해야 함)을 정면으로 위반합니다. 현재 테스트는 newer session이 아직 활성인 동안의 stale 이벤트만 다루고 있어 이 회귀를 놓칩니다."],"medium":[],"low":[],"residual_risks":[]}