{"high":[],"medium":["app/session_store.py:5-14, app/presence_hub.py:7-20, tests/test_presence_race.py:54-72 — 이번 수정은 더 낮은 `epoch`의 stale 이벤트는 막지만, 동일한 `session_id`/`epoch`에서 `connected -> disconnected -> 지연된 connected`가 재도착하는 경우를 막지 못합니다. 재현은 `apply_presence_event(\"u\", {\"session_id\":\"s1\",\"epoch\":1,\"state\":\"connected\"}, ...)` 후 같은 `session_id`/`epoch`로 `disconnected`, 다시 `connected`를 적용하면 `store.current(\"u\")`와 `online_state[\"u\"]`가 다시 복구됩니다. 현재 테스트도 이 경로를 검증하지 않아, 이미 offline 처리된 사용자가 다시 online으로 보이는 회귀가 남아 있습니다."],"low":[],"residual_risks":["동일 `epoch`에서 서로 다른 `session_id`가 들어오는 tie-case 정책은 여전히 구현/문서/테스트 어디에도 정의돼 있지 않아 별도 검증이 필요합니다.","검증은 단위 테스트와 로컬 게이트 명령 수준으로만 확인됐고, 실제 transport에서 중복/재정렬된 presence 이벤트가 들어올 때의 end-to-end 동작은 확인되지 않았습니다."]}