{"high":["[app/session_store.py:1-9](</Users/shinukyi/Gallary/projects/proto/agent-lab/artifacts/benchmark_runs/refined-skill-batch/c2-execution-xhigh__presence-race/workspace/app/session_store.py:1>), [app/session_store.py:26-33](</Users/shinukyi/Gallary/projects/proto/agent-lab/artifacts/benchmark_runs/refined-skill-batch/c2-execution-xhigh__presence-race/workspace/app/session_store.py:26>), [app/presence_hub.py:10](</Users/shinukyi/Gallary/projects/proto/agent-lab/artifacts/benchmark_runs/refined-skill-batch/c2-execution-xhigh__presence-race/workspace/app/presence_hub.py:10>), [app/client_presence.py:5](</Users/shinukyi/Gallary/projects/proto/agent-lab/artifacts/benchmark_runs/refined-skill-batch/c2-execution-xhigh__presence-race/workspace/app/client_presence.py:5>) `SessionStore`가 `disconnected`를 처리할 때 최신 `epoch` 기억까지 함께 삭제해서, reconnect ordering의 소유권이 저장소에 남지 않고 다시 이벤트 도착 순서에 의존하게 됩니다. 재현은 `connected(new, epoch=2) -> disconnected(new, epoch=2) -> connected(old, epoch=1)`이고, 현재 구현은 `store.current('user-1') == {'session_id': 'old', 'epoch': 1}` 및 `online_state['user-1'] == 'old'`로 stale 세션을 재도입합니다. 이건 단순 버그를 넘어 세션 수명주기 전체에서 ordering rule을 유지해야 하는 경계를 무너뜨린 sequencing 문제입니다. `SessionStore`가 tombstone이나 last_seen_epoch 같은 형태로 최신성 기준을 계속 소유해야 허브와 클라이언트가 late event를 일관되게 차단할 수 있습니다."],"medium":[],"low":[],"residual_risks":["[tests/test_presence_race.py:29](</Users/shinukyi/Gallary/projects/proto/agent-lab/artifacts/benchmark_runs/refined-skill-batch/c2-execution-xhigh__presence-race/workspace/tests/test_presence_race.py:29>) 현재 회귀 테스트는 '최신 세션이 이미 끊긴 뒤 늦게 온 더 오래된 connected' 경로를 다루지 않아, 위 sequencing 결함이 다시 들어와도 잡아주지 못합니다.","`should_accept_event`를 공용 규칙으로 둔 선택 자체와 `presence_hub`가 저장소 스냅샷 뒤에 클라이언트 병합을 수행하도록 한 구조는 이번 작업 범위에 맞는 집중된 수정이었습니다. 문제는 추상화가 과한 데 있지 않고, 최신성 상태를 disconnect 이후까지 보존하지 못해 ownership이 lifecycle 전반으로 닫히지 않은 점입니다."]}