{"high":[],"medium":["파일/라인: tests/test_tenant_cache_scope.py:8-24\n문제: 유일한 회귀 테스트가 서로 다른 tenant 간 분리만 확인하고, 동일 tenant에서 cache hit가 계속 재사용되는지는 검증하지 않습니다.\n영향: 이번 작업의 명시 요구사항인 \"caching을 유지한다\"가 자동화된 테스트로 보호되지 않아, 향후 동일 tenant 요청에서 cache를 우회하는 회귀가 들어와도 현재 스위트는 그대로 통과할 수 있습니다."],"low":["파일/라인: benchmark_outputs/execution_report.md:21-25\n문제: 실행 보고서는 `python3 -m compileall app tests`가 sandbox 때문에 막혔다고 기록하지만, 현재 샌드박스에서 동일 명령을 재실행하면 정상 통과합니다.\n영향: 벤치마크 증적이 실제 검증 상태와 어긋나서 후속 reviewer나 자동 수집기가 compile gate 실패로 잘못 판단할 수 있습니다."],"residual_risks":["`project_summary_cache_key()`가 `tenant_id`와 `project_slug`를 `:`로 단순 연결하는 방식이라, 두 식별자에 `:`가 허용되는 시스템인지 여부는 아직 검증되지 않았습니다.","현재 샌드박스에서 `python3 -m unittest discover -s tests -v`, `python3 -m compileall app tests`, `python3 scripts/docs_check.py`는 모두 통과했지만, 이 결과를 반영하도록 `benchmark_outputs/execution_report.md`는 갱신되지 않았습니다."]}