{"high":[],"medium":[],"low":["[benchmark_outputs/execution_report.md] `compile_pass`를 실패로 기록했지만, 현재 샌드박스에서 같은 게이트 명령 `python3 -m compileall app tests`를 재실행하면 정상 통과합니다. 실행 보고서가 실제 검증 상태와 어긋나 있어 검토자나 자동 평가를 오도할 수 있습니다."],"residual_risks":["현재 저장소 안에서 `project_summary_cache_key`의 호출부는 모두 갱신된 것을 확인했지만, 저장소 밖 소비자가 있다면 새 시그니처 `project_summary_cache_key(tenant_id, project_slug)`를 함께 반영했는지는 이 샌드박스 범위만으로는 검증할 수 없습니다."]}