{"high":[],"medium":[],"low":[],"residual_risks":["현재 diff와 `python3 -m unittest discover -s tests -v`, `python3 -m compileall app tests`, `python3 scripts/docs_check.py` 재실행 기준으로는 concrete defect를 찾지 못했습니다.","동일 `epoch`에서 서로 다른 `session_id`가 도착할 때의 tie-break 동작은 여전히 문서와 테스트로 고정되어 있지 않아, 프로토콜이 그 경우를 허용한다면 후속 검증이 필요합니다.","`SessionStore`가 disconnect 이후에도 마지막 active session 레코드를 유지하는 lifecycle semantics는 이번 변경 범위 밖이라, 오프라인 이후 재연결/정리 흐름까지 포함한 별도 검증이 남아 있습니다."]}