{"high":["`hold`가 맞습니다. 코드 정합성 자체는 [app/flags.py](/Users/shinukyi/Gallary/projects/proto/agent-lab/artifacts/benchmark_runs/refined-skill-batch/c2-all-gpt54-high__flag-rollout-fallback/workspace/app/flags.py:5), [app/telemetry.py](/Users/shinukyi/Gallary/projects/proto/agent-lab/artifacts/benchmark_runs/refined-skill-batch/c2-all-gpt54-high__flag-rollout-fallback/workspace/app/telemetry.py:9), [tests/test_flag_rollout_fallback.py](/Users/shinukyi/Gallary/projects/proto/agent-lab/artifacts/benchmark_runs/refined-skill-batch/c2-all-gpt54-high__flag-rollout-fallback/workspace/tests/test_flag_rollout_fallback.py:8) 기준으로 요구사항에 부합하고, `benchmark_task.json`의 3개 gate command도 현재 재실행 시 모두 통과했습니다. 하지만 `benchmark_outputs/release_gate_decision.md`가 없어 운영자용 최종 go/no-go 판정, blocker 목록, 후속 액션이 비어 있으므로 `release-ready` 또는 현재 `trace_record.json`의 `result: \"pass\"`를 그대로 승인 근거로 삼을 수 없습니다.","`benchmark_outputs/release_artifact_package.md`가 없습니다. 이 파일이 없으면 release note, rollout sequencing, rollback/runbook, telemetry 관찰 포인트를 운영자가 한곳에서 확인할 수 없고, 이번 변경이 remote config failure fallback과 exposure telemetry를 함께 건드리는 점을 감안하면 operator-visible artifact 부재는 릴리스 blocker입니다."],"medium":["`benchmark_outputs/approval_decision.md`가 없어 approval completeness가 입증되지 않았습니다. 이번 변경은 외부 config 실패 시 동작과 rollout safety를 바꾸므로 배포 단계에서의 approval tier, 허용된 범위, 필요한 승인 주체가 문서화되어 있어야 합니다. `승인 필요 없음`이 결론이더라도 그 판단 자체가 산출물로 남아야 합니다.","[execution_report.md](/Users/shinukyi/Gallary/projects/proto/agent-lab/artifacts/benchmark_runs/refined-skill-batch/c2-all-gpt54-high__flag-rollout-fallback/workspace/benchmark_outputs/execution_report.md:18)는 필수 gate인 `python3 -m compileall app tests`가 실패했다고 적고 있지만, [gate_results.json](/Users/shinukyi/Gallary/projects/proto/agent-lab/artifacts/benchmark_runs/refined-skill-batch/c2-all-gpt54-high__flag-rollout-fallback/gate_results.json:14)과 이번 재실행 결과는 통과입니다. 검증 기록 불일치는 릴리스 패킷의 신뢰성을 떨어뜨리고, 누가 어떤 결과를 authoritative하게 봐야 하는지 모호하게 만듭니다."],"low":[],"residual_risks":["[ops/feature_rollout.md](/Users/shinukyi/Gallary/projects/proto/agent-lab/artifacts/benchmark_runs/refined-skill-batch/c2-all-gpt54-high__flag-rollout-fallback/workspace/ops/feature_rollout.md:1)에 rollback 문구는 있어 `escalate`까지 갈 정도의 무가이드 상태는 아닙니다. 따라서 현재 상황은 `escalate`보다는 `hold`가 더 정확합니다.","False-hold risk는 분명합니다. [execution_report.md](/Users/shinukyi/Gallary/projects/proto/agent-lab/artifacts/benchmark_runs/refined-skill-batch/c2-all-gpt54-high__flag-rollout-fallback/workspace/benchmark_outputs/execution_report.md:35)의 stale compile 실패 기록만 보면 불필요하게 보수적으로 막을 수 있습니다. 코드와 실제 gate 상태만 보면 과도한 hold 사유는 크지 않고, 지금의 hold 근거는 주로 누락된 승인/릴리스 산출물입니다."]}